{
  "url": "https://github.com/gip-inclusion/data-inclusion",
  "name": "data-inclusion",
  "description": "Ce projet agrège les données de l'insertion sociale et professionnelle. Il permet de géocoder, d'historiser et de publier ces informations via une API et en open data.",
  "language": "Python",
  "features": [
    "Données & Schémas",
    "Visualisation de données & Cartographie",
    "API & Intégrations",
    "Statistiques & Rapports",
    "Recherche & Filtres"
  ],
  "audience": "Professionnels",
  "dependencies": [
    "FastAPI",
    "Apache Airflow",
    "PostgreSQL",
    "MinIO",
    "MLflow",
    "Pandas",
    "Polars",
    "SQLAlchemy",
    "GeoPandas"
  ],
  "components": [
    "API REST & GraphQL",
    "PostgreSQL & SQL",
    "Python (scripts & backend)",
    "Pipeline de données",
    "Docker & Conteneurs",
    "Intelligence Artificielle / ML",
    "Stockage objet"
  ],
  "auth": {
    "methods": [
      "jwt"
    ]
  },
  "tests": [
    "pytest",
    "playwright",
    "locust"
  ],
  "lastActivity": "2026-10-26T09:32:50+01:00",
  "status": "active",
  "license": null,
  "hasDocumentation": true,
  "tags": [
    "Données & Open Data",
    "Python",
    "ETL & Pipelines de données",
    "Docker & Conteneurs",
    "Intelligence Artificielle & LLM",
    "Bases de données SQL"
  ]
}
