{
  "url": "https://github.com/datagouv/cadastre-bundler-api",
  "name": "cadastre-bundler-api",
  "description": "API permettant de télécharger les données cadastrales. Elle facilite l'accès et le téléchargement des données du cadastre.",
  "language": "JavaScript",
  "features": [
    "API & Intégrations",
    "Gestion documentaire & Fichiers"
  ],
  "audience": "Professionnels",
  "dependencies": [
    "Express",
    "geojson-stream",
    "lodash",
    "dotenv",
    "geojson2shp",
    "yazl"
  ],
  "components": [
    "API REST & GraphQL",
    "Node.js / NestJS",
    "TypeScript / JavaScript"
  ],
  "auth": {
    "methods": [
      "none"
    ]
  },
  "tests": [
    "Ava",
    "Supertest"
  ],
  "workflows": [],
  "lastActivity": "2024-03-11T16:59:21Z",
  "status": "active",
  "license": "MIT",
  "hasDocumentation": true,
  "metrics": {
    "stars": 2,
    "forks": 1,
    "openIssues": 1
  },
  "tags": [
    "Données & Open Data",
    "JavaScript"
  ]
}
