{
  "url": "https://github.com/IA-Generative/toolmesh",
  "name": "toolmesh",
  "description": "Plateforme de gestion d'outils et de services utilisant le protocole MCP, avec une authentification centralisée via Keycloak et support de l'échange de jetons pour la sécurité inter-services.",
  "language": "Python",
  "features": [
    "Authentification & Accès",
    "API & Intégrations",
    "Intelligence Artificielle & NLP",
    "Sécurité & Conformité"
  ],
  "audience": "Développeurs",
  "dependencies": [
    "FastAPI",
    "Keycloak",
    "Uvicorn",
    "Pydantic",
    "PyJWT",
    "MCP",
    "Docker",
    "Helm"
  ],
  "components": [
    "API REST & GraphQL",
    "Python (scripts & backend)",
    "Docker & Conteneurs",
    "CI/CD & Déploiement",
    "Authentification (composant)",
    "Intelligence Artificielle / ML",
    "Kubernetes & Helm"
  ],
  "auth": {
    "methods": [
      "oauth2",
      "jwt",
      "sso"
    ],
    "providers": [
      "Keycloak"
    ]
  },
  "tests": "pytest",
  "workflows": [
    "ci.yml",
    "cd.yml",
    "lint.yml",
    "unit-tests.yml"
  ],
  "lastActivity": "2026-10-13T18:28:04+02:00",
  "status": "active",
  "license": "Apache-2.0",
  "hasDocumentation": true,
  "metrics": {
    "stars": 0,
    "forks": 0,
    "openIssues": 13
  },
  "tags": [
    "Python",
    "Intelligence Artificielle & LLM",
    "Docker & Conteneurs",
    "CI/CD & GitHub Actions",
    "Git & DevOps",
    "Sécurité & Auth"
  ]
}
