{
  "url": "https://github.com/betagouv/prestagri",
  "name": "prestagri",
  "description": "Prest'Agri est un outil pour simplifier les procédures administratives liées aux prestations sociales, initialement conçu pour le Ministère de l'Agriculture.",
  "language": "Python",
  "features": [
    "Gestion documentaire & Fichiers",
    "API & Intégrations"
  ],
  "audience": "Agents de l'Administration",
  "dependencies": [
    "Grist",
    "One Trick Pony"
  ],
  "components": [
    "API REST & GraphQL",
    "TypeScript / JavaScript",
    "Documentation & Schémas"
  ],
  "auth": {
    "methods": [
      "none"
    ]
  },
  "tests": [
    "pytest"
  ],
  "workflows": [
    "deploy.yml"
  ],
  "lastActivity": "2026-04-24T17:49:54+02:00",
  "status": "active",
  "license": "Apache-2.0",
  "hasDocumentation": true,
  "metrics": {
    "stars": 0,
    "forks": 3,
    "contributors": 0,
    "openIssues": 12
  },
  "tags": [
    "Données & Open Data",
    "Écosystème beta.gouv / État"
  ]
}
