{
  "url": "https://github.com/numerique-gouv/statistiques-impact",
  "name": "statistiques-impact",
  "description": "Ce site répertorie les produits opérés par l'Opérateur de Produits Interministériels (OPI) ainsi que leurs statistiques d'usage pour suivre l'impact des services publics numériques.",
  "language": "Python",
  "features": [
    "Statistiques & Rapports",
    "Visualisation de données & Cartographie",
    "Gestion des utilisateurs & Permissions",
    "API & Intégrations"
  ],
  "audience": "Agents de l'Administration",
  "dependencies": [
    "Django",
    "Django REST Framework",
    "PostgreSQL",
    "Pandas",
    "datagouv-client",
    "drf-spectacular",
    "django-dsfr"
  ],
  "components": [
    "API REST & GraphQL",
    "Django",
    "PostgreSQL & SQL",
    "Python (scripts & backend)",
    "Templates & Moteurs de rendu"
  ],
  "auth": {
    "methods": [
      "api-key"
    ]
  },
  "tests": "pytest",
  "workflows": [
    "tests.yml"
  ],
  "lastActivity": "2026-10-13T19:21:38+02:00",
  "status": "active",
  "license": "MIT",
  "hasDocumentation": true,
  "metrics": {
    "stars": 4,
    "forks": 2,
    "contributors": 0,
    "openIssues": 17
  },
  "tags": [
    "Données & Open Data",
    "Écosystème beta.gouv / État",
    "Python",
    "Bases de données SQL",
    "Reporting & BI"
  ]
}
