{
  "url": "https://github.com/demarche-numerique/doc-v2.demarche.numerique.gouv.fr",
  "name": "doc-v2.demarche.numerique.gouv.fr",
  "description": "Documentation de la version 2 du projet démarche numérique.",
  "lastActivity": "2026-09-07T15:52:40+02:00",
  "status": "active",
  "license": null,
  "hasDocumentation": true,
  "metrics": {
    "stars": 0,
    "forks": 0,
    "openIssues": 0
  },
  "tags": [
    "Documentation",
    "Écosystème beta.gouv / État"
  ]
}
