{
  "url": "https://github.com/SocialGouv/infra-apps",
  "name": "infra-apps",
  "description": "Ce dépôt contient les manifestes Kubernetes pour l'infrastructure de SocialGouv, orchestrés via ArgoCD. Il gère notamment la plateforme Iterion, les runners de CI/CD et les services de stockage.",
  "language": "Python",
  "features": [
    "Infrastructure & Stockage",
    "Sécurité & Conformité",
    "Intelligence Artificielle & NLP",
    "Monitoring & Logs"
  ],
  "audience": "Développeurs",
  "dependencies": [
    "Kubernetes",
    "ArgoCD",
    "SeaweedFS",
    "MongoDB",
    "NATS",
    "Valkey",
    "ClamAV",
    "Metabase"
  ],
  "components": [
    "Kubernetes & Helm",
    "CI/CD & Déploiement",
    "Docker & Conteneurs",
    "MongoDB & NoSQL",
    "Serveurs web & Proxy"
  ],
  "auth": {
    "methods": [
      "oauth2",
      "jwt",
      "sso"
    ],
    "providers": [
      "GitHub",
      "GitLab"
    ]
  },
  "tests": "Tests E2E et runners CI",
  "workflows": [
    "ArgoCD GitOps",
    "ARC Runners CI/CD"
  ],
  "lastActivity": "2026-10-22T22:18:44+02:00",
  "status": "active",
  "license": null,
  "hasDocumentation": true,
  "tags": [
    "Git & DevOps",
    "Docker & Conteneurs",
    "Kubernetes & Helm",
    "Intelligence Artificielle & LLM",
    "Déploiement & Hosting"
  ]
}
