{
  "url": "https://github.com/betagouv/gestion-eclairee",
  "name": "gestion-eclairee",
  "description": "Ce projet permet l'analyse des dépenses publiques. Il vise à faciliter la compréhension et le suivi des finances publiques.",
  "language": "Python",
  "features": [
    "Gestion des utilisateurs & Permissions",
    "Visualisation de données & Cartographie",
    "API & Intégrations",
    "Statistiques & Rapports"
  ],
  "audience": "Agents de l'Administration",
  "dependencies": [
    "Django",
    "Django-DSFR",
    "psycopg",
    "pandas",
    "mozilla-django-oidc"
  ],
  "components": [
    "API REST & GraphQL",
    "PostgreSQL & SQL",
    "Python (scripts & backend)",
    "Django"
  ],
  "auth": {
    "methods": [
      "oauth2"
    ]
  },
  "tests": [
    "pytest"
  ],
  "workflows": [],
  "lastActivity": "2026-07-15T16:51:36+02:00",
  "status": "active",
  "license": null,
  "hasDocumentation": true,
  "metrics": {
    "stars": 0,
    "forks": 0,
    "contributors": 1,
    "openIssues": 0
  },
  "tags": [
    "Données & Open Data",
    "Écosystème beta.gouv / État",
    "Python",
    "Bases de données SQL"
  ]
}
