{
  "url": "https://github.com/betagouv/depenses-eclairees-metabase-scalingo",
  "name": "depenses-eclairees-metabase-scalingo",
  "description": "Ce projet facilite le déploiement de l'outil de Business Intelligence Metabase sur la plateforme Scalingo, incluant une configuration pour l'authentification via OAuth2.",
  "language": "Shell",
  "features": [
    "Visualisation de données & Cartographie",
    "Authentification & Accès",
    "Statistiques & Rapports"
  ],
  "audience": "Professionnels",
  "dependencies": [
    "Metabase",
    "Scalingo",
    "PostgreSQL",
    "oauth2-proxy"
  ],
  "components": [
    "Reporting & BI",
    "CI/CD & Déploiement",
    "PostgreSQL & SQL",
    "Authentification (composant)"
  ],
  "auth": {
    "methods": [
      "oauth2"
    ]
  },
  "lastActivity": "2026-05-29T22:01:22+02:00",
  "status": "active",
  "license": null,
  "hasDocumentation": true,
  "metrics": {
    "stars": 0,
    "forks": 0,
    "openIssues": 0
  },
  "tags": [
    "Reporting & BI",
    "Déploiement & Hosting",
    "Données & Open Data"
  ]
}
