{
  "url": "https://github.com/datagouv/albert-api-client-playground",
  "name": "albert-api-client-playground",
  "description": "Ce projet est un environnement de test pour interagir avec l'API Albert, une API d'IA souveraine française, offrant des implémentations en Python et TypeScript ainsi que des exemples de tests.",
  "language": "Python",
  "features": [
    "API & Intégrations"
  ],
  "audience": "Développeurs",
  "dependencies": [
    "dotenv",
    "httpx",
    "axios",
    "form-data"
  ],
  "components": [
    "API REST & GraphQL",
    "Python (scripts & backend)",
    "TypeScript / JavaScript"
  ],
  "auth": {
    "methods": [
      "api-key"
    ]
  },
  "tests": [
    "Tests unitaires (TypeScript et Python)"
  ],
  "workflows": [],
  "lastActivity": "2026-04-13T17:37:29+02:00",
  "status": "active",
  "license": "MIT",
  "hasDocumentation": true,
  "metrics": {
    "stars": 1,
    "forks": 0,
    "contributors": 0,
    "openIssues": 0
  },
  "tags": [
    "Données & Open Data",
    "Intelligence Artificielle & LLM",
    "Python",
    "TypeScript"
  ]
}
