{
  "url": "https://github.com/dnum-mi/referentiel-applications",
  "name": "referentiel-applications",
  "description": "Catalogue et gère les informations sur les applications utilisées au sein du ministère de l'Intérieur. Il sert de point de vérité unique pour répertorier et gouverner les métadonnées applicatives (statut, acteurs, conformité, hébergement, etc.).",
  "language": "TypeScript",
  "features": [
    "Gestion métier générale",
    "Administration & Backoffice",
    "Statistiques & Rapports",
    "Sécurité & Conformité",
    "Données & Schémas",
    "Recherche & Filtres",
    "Suivi & Traçabilité"
  ],
  "audience": "Agents de l'Administration",
  "dependencies": [
    "NestJS",
    "Prisma",
    "PostgreSQL",
    "Vue.js",
    "Keycloak",
    "DSFR",
    "Docker",
    "pnpm"
  ],
  "components": [
    "API REST & GraphQL",
    "PostgreSQL & SQL",
    "Vue.js / Nuxt",
    "TypeScript / JavaScript",
    "Design System (DSFR & UI libs)",
    "Docker & Conteneurs",
    "Node.js / NestJS",
    "Authentification (composant)"
  ],
  "auth": {
    "methods": [
      "oauth2",
      "jwt",
      "sso"
    ],
    "providers": [
      "Keycloak"
    ]
  },
  "tests": "E2E tests via pnpm",
  "workflows": [
    "GitHub Actions"
  ],
  "lastActivity": "2026-10-21T00:00:00Z",
  "status": "maintained",
  "license": "MIT",
  "hasDocumentation": true,
  "tags": [
    "Écosystème beta.gouv / État",
    "TypeScript",
    "Vue.js & Nuxt",
    "Node.js, NestJS & Express",
    "Docker & Conteneurs",
    "Bases de données SQL",
    "CI/CD & GitHub Actions",
    "Design System & UI",
    "Documentation"
  ]
}
