{
  "url": "https://github.com/betagouv/portail-rse",
  "name": "portail-rse",
  "description": "Un portail permettant aux entreprises de connaître et de répondre à leurs obligations en matière de Responsabilité Sociétale des Entreprises (RSE). Il propose des outils d'analyse et de suivi des indicateurs de durabilité.",
  "language": "Python",
  "features": [
    "Gestion métier générale",
    "Visualisation de données & Cartographie",
    "Intelligence Artificielle & NLP",
    "Formulaires & Démarches",
    "Statistiques & Rapports",
    "Authentification & Accès",
    "Gestion des utilisateurs & Permissions",
    "Tableaux & Affichage"
  ],
  "audience": "Professionnels",
  "dependencies": [
    "Django",
    "Svelte",
    "PostgreSQL",
    "Redis",
    "MinIO",
    "Metabase",
    "Sentry",
    "Brevo",
    "ProConnect"
  ],
  "components": [
    "API REST & GraphQL",
    "PostgreSQL & SQL",
    "Angular / Svelte / Autres SPA",
    "TypeScript / JavaScript",
    "Python (scripts & backend)",
    "Design System (DSFR & UI libs)",
    "Docker & Conteneurs",
    "Authentification (composant)",
    "Intégrations services externes",
    "ORM & Accès aux données",
    "Templates & Moteurs de rendu",
    "Django"
  ],
  "auth": {
    "methods": [
      "oauth2",
      "sso"
    ],
    "providers": [
      "ProConnect",
      "France Connect"
    ]
  },
  "tests": [
    "pytest-django",
    "pytest-mock"
  ],
  "workflows": [
    "test.yml"
  ],
  "lastActivity": "2026-10-23T10:34:12+02:00",
  "status": "active",
  "license": null,
  "hasDocumentation": true,
  "tags": [
    "Données & Open Data",
    "Écosystème beta.gouv / État",
    "TypeScript",
    "Python",
    "Bases de données SQL",
    "Design System & UI",
    "CI/CD & GitHub Actions",
    "Environnement & Énergie",
    "Intelligence Artificielle & LLM"
  ]
}
