{
  "url": "https://github.com/suitenumerique/people",
  "name": "people",
  "description": "Application de gestion des utilisateurs, des équipes et de la distribution des permissions pour l'écosystème La Suite. Elle permet également la gestion des domaines de messagerie et des alias.",
  "language": "Python",
  "features": [
    "Gestion des utilisateurs & Permissions",
    "Gestion des équipes & Partenaires",
    "Authentification & Accès",
    "Gestion des profils & Comptes",
    "Administration & Backoffice"
  ],
  "audience": "Agents de l'Administration",
  "dependencies": [
    "Django Rest Framework",
    "PostgreSQL",
    "Redis",
    "Celery",
    "Keycloak",
    "Next.js",
    "Docker"
  ],
  "components": [
    "API REST & GraphQL",
    "PostgreSQL & SQL",
    "React / Next.js",
    "Docker & Conteneurs",
    "Celery & Queue asynchrone",
    "Authentification (composant)",
    "TypeScript / JavaScript"
  ],
  "auth": {
    "methods": [
      "jwt",
      "session"
    ]
  },
  "tests": "Pytest",
  "workflows": [
    "GitHub Actions"
  ],
  "lastActivity": "2026-10-12T16:52:36Z",
  "status": "active",
  "license": "MIT",
  "hasDocumentation": true,
  "tags": [
    "Écosystème beta.gouv / État",
    "Python",
    "TypeScript",
    "React & Next.js",
    "Docker & Conteneurs",
    "Bases de données SQL",
    "Sécurité & Auth",
    "CI/CD & GitHub Actions"
  ]
}
