{
  "url": "https://github.com/betagouv/pass-sport",
  "name": "pass-sport",
  "description": "Plateforme permettant de vérifier l'éligibilité au Pass Sport et de trouver des clubs sportifs. Elle intègre un parcours utilisateur via FranceConnect et des outils de traitement de données pour l'administration.",
  "language": "TypeScript",
  "features": [
    "Authentification & Accès",
    "Aides & Éligibilité",
    "Recherche & Filtres",
    "Formulaires & Démarches",
    "Statistiques & Rapports"
  ],
  "audience": "Grand public",
  "dependencies": [
    "Next.js",
    "React",
    "TypeScript",
    "Python",
    "Pandas",
    "DSFR",
    "Sentry",
    "Matomo",
    "Ansible",
    "Scalingo"
  ],
  "components": [
    "React / Next.js",
    "TypeScript / JavaScript",
    "Python (scripts & backend)",
    "Design System (DSFR & UI libs)",
    "CI/CD & Déploiement",
    "API REST & GraphQL"
  ],
  "auth": {
    "methods": [
      "oauth2",
      "sso"
    ],
    "providers": [
      "FranceConnect"
    ]
  },
  "tests": "npm run test",
  "workflows": [
    "Scalingo review apps",
    "Ansible deployment"
  ],
  "lastActivity": "2026-10-19T12:26:22+02:00",
  "status": "active",
  "hasDocumentation": true,
  "tags": [
    "Écosystème beta.gouv / État",
    "React & Next.js",
    "TypeScript",
    "Python",
    "Accessibilité",
    "Design System & UI"
  ]
}
