{
  "url": "https://github.com/MTES-MCT/mobilic",
  "name": "mobilic",
  "description": "Plateforme visant à simplifier le suivi du temps de travail dans le transport routier léger pour lutter contre le travail illégal. Elle propose une PWA pour la saisie des temps par les salariés et des tableaux de bord pour les gestionnaires et les corps de contrôle.",
  "language": "TypeScript",
  "features": [
    "Gestion des utilisateurs & Permissions",
    "Formulaires & Démarches",
    "Statistiques & Rapports",
    "Notifications & Alertes",
    "Interface utilisateur & Design",
    "Suivi & Traçabilité",
    "Accessibilité & i18n",
    "Tableaux & Affichage"
  ],
  "audience": "Professionnels",
  "dependencies": [
    "React",
    "Apollo Client",
    "GraphQL",
    "Sass",
    "Material UI",
    "Redux",
    "Sentry",
    "Workbox",
    "@codegouvfr/react-dsfr"
  ],
  "components": [
    "React / Next.js",
    "TypeScript / JavaScript",
    "API REST & GraphQL",
    "Design System (DSFR & UI libs)",
    "CI/CD & Déploiement",
    "HTML / CSS / Templates visuels",
    "Scripts & Utilitaires"
  ],
  "auth": {
    "methods": [
      "jwt"
    ]
  },
  "tests": [
    "react-test-renderer"
  ],
  "workflows": [
    "CircleCI"
  ],
  "lastActivity": "2026-10-15T18:52:33+02:00",
  "status": "active",
  "license": "MIT",
  "hasDocumentation": true,
  "tags": [
    "Transport & Mobilité",
    "Écosystème beta.gouv / État",
    "React & Next.js",
    "TypeScript",
    "JavaScript",
    "Design System & UI",
    "Git & DevOps",
    "Accessibilité"
  ]
}
