{
  "url": "https://github.com/refugies-info/playground",
  "name": "playground",
  "description": "Plateforme de workflow éditorial assistée par IA pour Refugies.info. Elle permet d'automatiser l'ingestion, la réécriture et la validation de contenus tout en garantissant un contrôle humain.",
  "language": "TypeScript",
  "features": [
    "Intelligence Artificielle & NLP",
    "Gestion documentaire & Fichiers",
    "Authentification & Accès",
    "Collaboration & Workflow",
    "Données & Schémas",
    "Interface utilisateur & Design"
  ],
  "audience": "Professionnels",
  "dependencies": [
    "Next.js",
    "Supabase",
    "Letta Cloud",
    "Tailwind CSS",
    "shadcn/ui",
    "Turborepo",
    "Zod",
    "Vitest"
  ],
  "components": [
    "React / Next.js",
    "TypeScript / JavaScript",
    "PostgreSQL & SQL",
    "Intelligence Artificielle / ML",
    "Docker & Conteneurs",
    "Design System (DSFR & UI libs)",
    "Tests"
  ],
  "auth": {
    "methods": [
      "jwt",
      "session"
    ]
  },
  "tests": [
    "Vitest",
    "Playwright"
  ],
  "workflows": [
    "GitHub Actions"
  ],
  "lastActivity": "2026-10-08T09:25:55+02:00",
  "status": "active",
  "license": null,
  "hasDocumentation": true,
  "tags": [
    "Intelligence Artificielle & LLM",
    "TypeScript",
    "React & Next.js",
    "Docker & Conteneurs",
    "CI/CD & GitHub Actions",
    "Design System & UI"
  ]
}
