{
  "url": "https://github.com/suitenumerique/encryption",
  "name": "encryption",
  "description": "Fournit une logique d'encryption commune à différents produits de la SuiteNumérique.",
  "features": [
    "Sécurité & Conformité"
  ],
  "audience": "Développeurs",
  "auth": {
    "methods": [
      "none"
    ]
  },
  "lastActivity": "2026-03-18T01:41:42+01:00",
  "status": "active",
  "license": "MIT",
  "hasDocumentation": true,
  "metrics": {
    "stars": 1,
    "forks": 0,
    "openIssues": 1
  },
  "tags": [
    "Sécurité & Auth"
  ]
}
