{
  "url": "https://github.com/SocialGouv/srdt",
  "name": "srdt",
  "description": "Assistant virtuel spécialisé dans le droit du travail, utilisant l'intelligence artificielle et le RAG pour fournir des réponses juridiques précises basées sur le Code du travail et la jurisprudence.",
  "language": "Python",
  "features": [
    "Intelligence Artificielle & NLP",
    "Recherche & Filtres",
    "Statistiques & Rapports",
    "Interface utilisateur & Design",
    "Sécurité & Conformité"
  ],
  "audience": "Professionnels",
  "dependencies": [
    "Poetry",
    "pnpm",
    "Docker",
    "Mistral",
    "ChatGPT",
    "Elasticsearch",
    "Metabase",
    "Matomo",
    "Sentry",
    "Albert"
  ],
  "components": [
    "API REST & GraphQL",
    "Python (scripts & backend)",
    "TypeScript / JavaScript",
    "React / Next.js",
    "Docker & Conteneurs",
    "Intelligence Artificielle / ML",
    "Pipeline de données"
  ],
  "auth": {
    "methods": [
      "api-key",
      "sso"
    ],
    "providers": [
      "Proconnect"
    ]
  },
  "tests": [
    "ruff",
    "pyright",
    "pre-commit"
  ],
  "lastActivity": "2026-10-21T00:00:00Z",
  "status": "active",
  "license": "MIT",
  "hasDocumentation": true,
  "tags": [
    "Intelligence Artificielle & LLM",
    "Python",
    "TypeScript",
    "Docker & Conteneurs",
    "Legal & Conformité",
    "Données & Open Data"
  ]
}
