{
  "url": "https://github.com/betagouv/portail-rse-externe",
  "name": "portail-rse-externe",
  "description": "Ce dépôt contient les sources des applications externes pour le Portail RSE, incluant une API connectée à un moteur d'intelligence artificielle pour l'analyse de données ESG.",
  "language": "Python",
  "features": [
    "Intelligence Artificielle & NLP",
    "Données & Schémas",
    "Gestion documentaire & Fichiers",
    "API & Intégrations",
    "Statistiques & Rapports"
  ],
  "audience": "Professionnels",
  "dependencies": [
    "Flask",
    "Celery",
    "Redis",
    "OpenAI",
    "LangChain",
    "Pandas",
    "PyMuPDF",
    "Docker",
    "Caddy"
  ],
  "components": [
    "API REST & GraphQL",
    "Celery & Queue asynchrone",
    "Docker & Conteneurs",
    "Python (scripts & backend)",
    "Intelligence Artificielle / ML",
    "Serveurs web & Proxy"
  ],
  "auth": {
    "methods": [
      "jwt"
    ]
  },
  "tests": [
    "pytest"
  ],
  "lastActivity": "2026-08-28T18:21:07+02:00",
  "status": "active",
  "license": "MIT",
  "hasDocumentation": true,
  "metrics": {
    "stars": 2,
    "forks": 0,
    "openIssues": 0
  },
  "tags": [
    "Données & Open Data",
    "Python",
    "Docker & Conteneurs",
    "Intelligence Artificielle & LLM",
    "Écosystème beta.gouv / État"
  ]
}
