{
  "url": "https://github.com/suitenumerique/cunningham",
  "name": "cunningham",
  "description": "Cunningham est un système de design et une bibliothèque de composants modulaires et réutilisables, mettant l'accent sur l'accessibilité et la cohérence via des design tokens.",
  "language": "TypeScript",
  "features": [
    "Interface utilisateur & Design",
    "Accessibilité & i18n",
    "Personnalisation & Thèmes"
  ],
  "audience": "Développeurs",
  "dependencies": [
    "React",
    "Sass",
    "@gouvfr-lasuite/cunningham-tokens",
    "Vite",
    "Storybook",
    "React Aria",
    "TanStack Table",
    "React Modal"
  ],
  "components": [
    "React / Next.js",
    "TypeScript / JavaScript",
    "Design System (DSFR & UI libs)",
    "HTML / CSS / Templates visuels"
  ],
  "auth": {
    "methods": [
      "none"
    ],
    "providers": []
  },
  "tests": [
    "Vitest",
    "Jest",
    "Cypress",
    "Testing Library"
  ],
  "workflows": [
    "GitHub Actions",
    "CircleCI"
  ],
  "lastActivity": "2026-07-16T16:20:15+02:00",
  "status": "active",
  "license": "MIT",
  "hasDocumentation": true,
  "metrics": {
    "stars": 59,
    "forks": 13,
    "openIssues": 39
  },
  "tags": [
    "Design System & UI",
    "React & Next.js",
    "TypeScript",
    "Accessibilité",
    "HTML, CSS & Web"
  ]
}
