{
  "url": "https://github.com/betagouv/transports-sanitaires-sites-conformes",
  "name": "transports-sanitaires-sites-conformes",
  "description": "Permet la création simplifiée de sites internet conformes aux normes numériques de l'État français en utilisant le Système de design de l'État (DSFR). Basé sur Django et Wagtail, il facilite la gestion de contenu pour les domaines en .gouv.fr.",
  "language": "Python",
  "features": [
    "Interface utilisateur & Design",
    "Administration & Backoffice",
    "Notifications & Alertes",
    "Sécurité & Conformité",
    "Contenu éditorial"
  ],
  "audience": "Agents de l'Administration",
  "dependencies": [
    "Django",
    "Wagtail",
    "PostgreSQL",
    "DSFR",
    "Gunicorn",
    "Boto3",
    "Sentry"
  ],
  "components": [
    "Python (scripts & backend)",
    "PostgreSQL & SQL",
    "Design System (DSFR & UI libs)",
    "Docker & Conteneurs",
    "Templates & Moteurs de rendu",
    "CMS (Strapi, Wagtail…)",
    "Authentification (composant)"
  ],
  "auth": {
    "methods": [
      "mfa",
      "sso"
    ],
    "providers": [
      "OIDC"
    ]
  },
  "tests": [
    "Playwright",
    "Coverage"
  ],
  "workflows": [
    "CI/CD"
  ],
  "lastActivity": "2026-09-22T10:44:06+02:00",
  "status": "maintained",
  "license": "AGPL-3.0",
  "hasDocumentation": true,
  "metrics": {
    "stars": 0,
    "forks": 0,
    "openIssues": 0
  },
  "tags": [
    "Écosystème beta.gouv / État",
    "Python",
    "Bases de données SQL",
    "Design System & UI",
    "Accessibilité",
    "Transport & Mobilité"
  ]
}
