{
  "url": "https://github.com/codegouvfr/react-dsfr",
  "name": "react-dsfr",
  "description": "Bibliothèque React implémentant le système de design de l'État français (DSFR). Elle permet de créer des interfaces web gouvernementales conformes, accessibles et identifiables pour les citoyens.",
  "language": "TypeScript",
  "features": [
    "Interface utilisateur & Design",
    "Accessibilité & i18n",
    "Personnalisation & Thèmes",
    "API & Intégrations"
  ],
  "audience": "Développeurs",
  "dependencies": [
    "React",
    "TypeScript",
    "@gouvfr/dsfr",
    "@mui/material",
    "@emotion/react",
    "@emotion/styled"
  ],
  "components": [
    "React / Next.js",
    "Design System (DSFR & UI libs)",
    "TypeScript / JavaScript",
    "Tests"
  ],
  "auth": {
    "methods": [
      "none"
    ],
    "providers": []
  },
  "tests": [
    "Vitest",
    "Storybook"
  ],
  "workflows": [
    "CI"
  ],
  "lastActivity": "2026-08-19T15:56:27+02:00",
  "status": "active",
  "license": "MIT",
  "hasDocumentation": true,
  "metrics": {
    "stars": 498,
    "forks": 95,
    "openIssues": 40
  },
  "tags": [
    "Design System & UI",
    "React & Next.js",
    "TypeScript",
    "Écosystème beta.gouv / État",
    "Accessibilité",
    "JavaScript"
  ]
}
