{
  "url": "https://github.com/proconnect-gouv/tailwindcss-dsfr-theme",
  "name": "tailwindcss-dsfr-theme",
  "description": "Ce projet propose un thème Tailwind CSS basé sur le Design System de l'État (DSFR). Il permet d'appliquer facilement les standards visuels de l'administration française dans des projets utilisant Tailwind CSS.",
  "features": [
    "Interface utilisateur & Design",
    "Personnalisation & Thèmes",
    "Accessibilité & i18n"
  ],
  "audience": "Développeurs",
  "dependencies": [
    "Tailwind CSS",
    "DSFR"
  ],
  "components": [
    "Design System (DSFR & UI libs)",
    "HTML / CSS / Templates visuels"
  ],
  "auth": {
    "methods": [
      "none"
    ],
    "providers": []
  },
  "lastActivity": "2026-09-14T09:07:09+02:00",
  "status": "active",
  "license": "MIT",
  "hasDocumentation": true,
  "metrics": {
    "stars": 0,
    "forks": 0,
    "openIssues": 0
  },
  "tags": [
    "Design System & UI",
    "HTML, CSS & Web",
    "Accessibilité",
    "Écosystème beta.gouv / État"
  ]
}
