{
  "url": "https://github.com/MTES-MCT/metabase-scalingo-docurba",
  "name": "metabase-scalingo-docurba",
  "description": "Ce projet permet de déployer l'outil de Business Intelligence Metabase sur la plateforme Scalingo. Il propose des configurations pour un déploiement rapide via un bouton 'one-click' ou par ligne de commande.",
  "language": "Shell",
  "features": [
    "Visualisation de données & Cartographie",
    "Infrastructure & Stockage"
  ],
  "audience": "Professionnels",
  "dependencies": [
    "Metabase",
    "Scalingo",
    "PostgreSQL"
  ],
  "components": [
    "Reporting & BI",
    "CI/CD & Déploiement",
    "Scripts & Utilitaires"
  ],
  "lastActivity": "2026-07-21T10:01:05+02:00",
  "status": "maintained",
  "license": null,
  "hasDocumentation": true,
  "metrics": {
    "stars": 0,
    "forks": 0,
    "openIssues": 0
  },
  "tags": [
    "Reporting & BI",
    "Git & DevOps",
    "Documentation"
  ]
}
